{
  "stage": "6_audit",
  "schema_version": "1.0.0",
  "run_id": "benchmark_code_review",
  "branch_id": "c",
  "findings": [
    {
      "pattern_id": "capacity.substitutes_for_practice",
      "axis": "capacity",
      "fired": false,
      "score": 0,
      "rationale": "The annotation scaffold does not perform the core skilled actions on the participant's behalf. Navigation (Step 1), architectural sketching (Step 3), and predictive debugging (Step 4) all require the participant to perform the substantive cognitive work unaided; the annotation in Step 2 provides supplementary references (historical commits, related modules, convention rationale) rather than completing the task. The study design preserves rehearsal space for the target skills."
    },
    {
      "pattern_id": "capacity.no_fade_mechanism",
      "axis": "capacity",
      "fired": true,
      "score": -1,
      "evidence_span": {
        "source": "prototype_spec",
        "quote": "For treatment participants: within 90 seconds of PR submission, the wizard injects a structured annotation block into the PR comment thread via the wizard control panel."
      },
      "rationale": "Across the 8–12 week longitudinal arc, the annotation scaffold fires at every Step 2 PR submission at a fixed level and format. There is no conditional gating (e.g., withholding annotations in later weeks, reducing their scope as participant confidence grows, or letting participants opt out of sections they've internalized). The assistance does not taper, which is a notable omission given the study's explicit interest in longitudinal mental-model formation."
    },
    {
      "pattern_id": "capacity.creates_dependency_loop",
      "axis": "capacity",
      "fired": false,
      "score": 0,
      "rationale": "The protocol explicitly measures unaided performance through the Step 1 navigation task, Step 3 sketching, and Step 4 predictive debugging, none of which involve the scaffold firing during the task itself. Observable signals track navigation directness, sketch accuracy, and prediction accuracy as capacity indicators rather than treating annotation invocation frequency as a success metric. The design is structured to detect rather than induce dependency."
    },
    {
      "pattern_id": "capacity.no_rehearsal_space",
      "axis": "capacity",
      "fired": false,
      "score": 0,
      "rationale": "The session structure itself functions as repeated low-stakes rehearsal: Steps 1, 3, and 4 are explicitly unaided skill-practice windows in which the annotation does not fire, and the weekly cadence provides sustained rehearsal across 8–12 sessions. The architectural sketching and predictive debugging tasks are framed as reasoning probes rather than performance evaluations, giving participants a bounded space to practice unaided architectural reasoning."
    },
    {
      "pattern_id": "agency.auto_decides_consequential_step",
      "axis": "agency",
      "fired": false,
      "score": 0,
      "rationale": "The annotation is explicitly labeled 'AI Learning Scaffold (for your reference — not a blocking review)' and does not commit to any external action. Participants make all consequential choices (which files to open, which arrows to draw, what fault location to predict, what to write in reflections). The wizard's variant selection affects annotation content but not any outcome binding on the participant or a third party."
    },
    {
      "pattern_id": "agency.hides_options_before_review",
      "axis": "agency",
      "fired": true,
      "score": -1,
      "evidence_span": {
        "source": "prototype_spec",
        "quote": "Select which pre-authored annotation set from the annotation library matches this week's focus area and the specific diff in the patch — the library contains 12 sets, one per anticipated focus area; choose the closest match even if not exact."
      },
      "rationale": "The participant sees a single annotation block (one of 12 pre-authored sets, in one of two variants) with no visibility into the space of alternatives the wizard selected from. The annotation's 'Related historical commits' and 'Related modules' sections each present 2–3 items as if definitive; the participant cannot see what other commits or modules were considered and rejected, nor the basis for inclusion. The walkthrough notes this framing functions as 'implicit authority' without option-space exposure."
    },
    {
      "pattern_id": "agency.weak_override",
      "axis": "agency",
      "fired": false,
      "score": 0,
      "rationale": "Override is not a relevant construct here because the annotation is advisory rather than a decision the participant must dismiss. The preface 'for your reference — not a blocking review' explicitly frames the annotation as non-binding, and participants can ignore it with zero friction by simply not acting on its content. There is no auto-decision flow requiring an override path."
    },
    {
      "pattern_id": "agency.paternalistic_default",
      "axis": "agency",
      "fired": false,
      "score": 0,
      "rationale": "Participants are mid-level software engineers with 2–6 years of professional experience, not a population historically subject to paternalistic assistive design (disabled users, elderly users, mental health contexts, children). The 'onboarding to an unfamiliar codebase' framing positions participants as competent professionals learning a specific system rather than as a stigmatized group requiring protective defaults."
    },
    {
      "pattern_id": "exit.data_lock_in",
      "axis": "exit",
      "fired": false,
      "score": 0,
      "rationale": "Session artifacts are stored in accessible, portable formats: CSV logs, Google Forms exports, PNG exports of Miro boards, and Zoom recordings. The Rails codebase used is open-source and cloned locally. There are no proprietary schemas or platform bindings that would prevent participants from taking their own produced content (reflections, learning) away from the study context."
    },
    {
      "pattern_id": "exit.workflow_lock_in",
      "axis": "exit",
      "fired": false,
      "score": 0,
      "rationale": "The study is structured as individual research sessions rather than team workflow integration. The fixture PR interface is a self-contained localhost:4000 simulation that does not alter the participant's actual work processes, team communication norms, or code review practices outside the study. Exit from the study does not require any collective switch-back by other actors or systems."
    },
    {
      "pattern_id": "exit.competence_decay_on_exit",
      "axis": "exit",
      "fired": true,
      "score": 1,
      "evidence_span": {
        "source": "prototype_spec",
        "quote": "During Part 2, treatment participants may open PRs on the fixture GitHub interface and receive wizard annotations; control participants may use only the pinned Rails documentation PDF and VS Code's global search."
      },
      "rationale": "The protocol actively instruments unaided competence at every session: Step 1 navigation, Step 3 sketching, and Step 4 predictive debugging all occur without the annotation firing. The analysis plan compares treatment-vs-control trajectories specifically to detect whether 'navigation paths become more direct... or broader over time,' which is precisely the competence-decay signal this pattern warns about. This is a scaffold-positive design choice that surfaces rather than obscures the exit risk."
    },
    {
      "pattern_id": "exit.institutional_dependence",
      "axis": "exit",
      "fired": false,
      "score": 0,
      "rationale": "The study uses open-source materials (Rails codebase), a self-hosted fixture (localhost:4000), and commodity tools (VS Code, Chrome, Zoom, Google Forms). Participants do not become dependent on any single vendor or institution for the skills or knowledge they develop during the study; the 'AI scaffold' itself is a wizard-of-oz simulation with no persistent service to depend on after the study ends."
    },
    {
      "pattern_id": "legibility.opaque_ranking",
      "axis": "legibility",
      "fired": true,
      "score": -1,
      "evidence_span": {
        "source": "prototype_spec",
        "quote": "(A) 'Related historical commits' listing 2–3 commit SHAs with one-sentence summaries drawn from the wizard's pre-prepared annotation library for this week's focus area; (B) 'Related modules' naming 2–3 files in the codebase with a one-sentence rationale for the connection"
      },
      "rationale": "The annotation presents 2–3 commits and 2–3 modules as a filtered selection from the much larger codebase without explaining the selection basis. The participant sees the shortlist but not the criteria — whether these are the most frequently touched, most recently modified, most pedagogically instructive, or simply what the wizard pre-authored. The walkthrough explicitly flags that participants may read this framing as 'implicit authority' without a visible ranking rationale at the point of decision."
    },
    {
      "pattern_id": "legibility.no_failure_signal",
      "axis": "legibility",
      "fired": true,
      "score": -1,
      "evidence_span": {
        "source": "prototype_spec",
        "quote": "choose the closest match even if not exact"
      },
      "rationale": "The wizard is instructed to select a 'closest match' annotation set even when no set cleanly fits the participant's specific diff, and the annotation is presented to the participant without any mismatch indicator. The walkthrough highlights this explicitly: 'Sessions in which the annotation matched poorly would plausibly produce different participant behaviors than sessions with tight matches, and the analysis plan does not currently treat annotation-fit quality as a moderator variable.' Participants have no in-flow signal when the scaffold is giving them suboptimally-matched content."
    },
    {